{
  "$schema": "https://yen-gov.github.io/schemas/boundary.sources.schema.json",
  "$schema_version": "1.0",
  "$comment": "CLAUDE.md §12 provenance sidecar for the GeoJSON of the same name. GeoJSON has no native top-level metadata slot; this file carries the required `sources` array on its behalf.",
  "for": "S01-ac.geojson",
  "sources": [
    {
      "url": "https://raw.githubusercontent.com/HindustanTimesLabs/shapefiles/master/state_ut/andhrapradesh/assembly/andhrapradesh_AC.json",
      "fetched_at": "2026-05-13T08:59:25Z"
    }
  ]
}
